{"type":"snapshot.ai","protocol_version":1,"schema_version":{"major":1,"minor":0},"generated_at":"2026-08-13T12:34:56Z","timezone":null,"provider_order":["codex"],"providers":[{"schema_version":{"major":1,"minor":0},"provider_id":"codex","display_name":"甲乙丙甲乙丙甲乙丙甲乙丙甲乙丙甲乙丙甲乙丙甲乙丙甲乙丙甲乙丙甲乙丙甲乙丙甲乙丙甲乙丙甲乙丙甲乙丙","status":"ok","source":"structured_http","confidence":"verified","experimental":false,"updated_at":null,"stale_after_seconds":null,"balance":null,"windows":[],"tokens":null,"error":null}],"sessions":[],"next_refresh_seconds":5}
