{
  "type":"snapshot.ai","protocol_version":1,"schema_version":{"major":1,"minor":0},
  "generated_at":"2026-08-13T12:34:56Z","timezone":"UTC",
  "provider_order":["codex","cursor","deepseek","aihubmix","local","offline"],
  "providers":[
    {"schema_version":{"major":1,"minor":0},"provider_id":"codex","display_name":"Codex","status":"degraded","source":"codex_app_server","confidence":"verified","experimental":false,"updated_at":"2026-08-13T12:34:55Z","stale_after_seconds":120,"balance":null,"windows":[],"tokens":null,"error":{"code":"auth_stale","retryable":false}},
    {"schema_version":{"major":1,"minor":0},"provider_id":"cursor","display_name":"Cursor","status":"degraded","source":"cursor_local","confidence":"inferred","experimental":true,"updated_at":"2026-08-13T12:34:55Z","stale_after_seconds":120,"balance":null,"windows":[],"tokens":null,"error":{"code":"permission_denied","retryable":false}},
    {"schema_version":{"major":1,"minor":0},"provider_id":"deepseek","display_name":"DeepSeek","status":"degraded","source":"structured_http","confidence":"verified","experimental":false,"updated_at":"2026-08-13T12:34:55Z","stale_after_seconds":300,"balance":{"amount_micros":123450000,"currency":"CNY"},"windows":[],"tokens":null,"error":{"code":"timeout","retryable":true}},
    {"schema_version":{"major":1,"minor":0},"provider_id":"aihubmix","display_name":"AIHubMix","status":"degraded","source":"structured_http","confidence":"verified","experimental":false,"updated_at":"2026-08-13T12:34:55Z","stale_after_seconds":300,"balance":null,"windows":[],"tokens":null,"error":{"code":"process_exited","retryable":true}},
    {"schema_version":{"major":1,"minor":0},"provider_id":"local","display_name":"Local","status":"degraded","source":"structured_http","confidence":"verified","experimental":true,"updated_at":"2026-08-13T12:34:55Z","stale_after_seconds":300,"balance":null,"windows":[],"tokens":null,"error":{"code":"schema_changed","retryable":false}},
    {"schema_version":{"major":1,"minor":0},"provider_id":"offline","display_name":"Offline","status":"unavailable","source":"none","confidence":"unavailable","experimental":false,"updated_at":null,"stale_after_seconds":null,"balance":null,"windows":[],"tokens":null,"error":{"code":"unavailable","retryable":true}}
  ],
  "sessions":[
    {"schema_version":{"major":1,"minor":0},"session_id":"owned_run","provider_id":"codex","display_name":null,"state":"running","source":"codex_app_server_owned","confidence":"verified","started_at":null,"last_activity_at":null,"duration_seconds":null,"turn_tokens":null,"context_used_basis_points":null},
    {"schema_version":{"major":1,"minor":0},"session_id":"owned_approve","provider_id":"codex","display_name":null,"state":"waiting_approval","source":"codex_app_server_owned","confidence":"verified","started_at":null,"last_activity_at":null,"duration_seconds":null,"turn_tokens":null,"context_used_basis_points":null},
    {"schema_version":{"major":1,"minor":0},"session_id":"owned_input","provider_id":"codex","display_name":null,"state":"waiting_input","source":"codex_app_server_owned","confidence":"verified","started_at":null,"last_activity_at":null,"duration_seconds":null,"turn_tokens":null,"context_used_basis_points":null},
    {"schema_version":{"major":1,"minor":0},"session_id":"owned_complete","provider_id":"codex","display_name":null,"state":"completed","source":"codex_app_server_owned","confidence":"verified","started_at":null,"last_activity_at":null,"duration_seconds":null,"turn_tokens":null,"context_used_basis_points":null},
    {"schema_version":{"major":1,"minor":0},"session_id":"owned_failed","provider_id":"codex","display_name":null,"state":"failed","source":"codex_app_server_owned","confidence":"verified","started_at":null,"last_activity_at":null,"duration_seconds":null,"turn_tokens":null,"context_used_basis_points":null},
    {"schema_version":{"major":1,"minor":0},"session_id":"observe_run","provider_id":"codex","display_name":null,"state":"running","source":"process_jsonl_observer","confidence":"inferred","started_at":null,"last_activity_at":null,"duration_seconds":null,"turn_tokens":null,"context_used_basis_points":null},
    {"schema_version":{"major":1,"minor":0},"session_id":"observe_recent","provider_id":"codex","display_name":null,"state":"recent","source":"process_jsonl_observer","confidence":"inferred","started_at":null,"last_activity_at":null,"duration_seconds":null,"turn_tokens":null,"context_used_basis_points":null},
    {"schema_version":{"major":1,"minor":0},"session_id":"observe_ended","provider_id":"codex","display_name":null,"state":"ended","source":"process_jsonl_observer","confidence":"inferred","started_at":null,"last_activity_at":null,"duration_seconds":null,"turn_tokens":null,"context_used_basis_points":null},
    {"schema_version":{"major":1,"minor":0},"session_id":"observe_unknown","provider_id":"codex","display_name":null,"state":"unknown","source":"process_jsonl_observer","confidence":"inferred","started_at":null,"last_activity_at":null,"duration_seconds":null,"turn_tokens":null,"context_used_basis_points":null},
    {"schema_version":{"major":1,"minor":0},"session_id":"state_unavailable","provider_id":"offline","display_name":null,"state":"unavailable","source":"none","confidence":"unavailable","started_at":null,"last_activity_at":null,"duration_seconds":null,"turn_tokens":null,"context_used_basis_points":null}
  ],
  "next_refresh_seconds":30
}
